political_party,top_keywords
ανεξαρτητοι (εκτος κομματος),"επιχειρης, προυπολογισμ, μετρ, οικονομικ, δεκ, κρατ, δαπαν, μπονους, ευρωπαικ, πιο, τροπ, εξετας, πασοκ, προτας, παιδ, αδει, παιδι, λογικ, μνημονι, υγει"
ανεξαρτητοι δημοκρατικοι βουλευτες,"χρηματοδοτης, δημοσι, συστημ, οπου, δανειοδοτης, προοδευτικοτητ, επιχορηγης, ρυθμις, ανωνυμι, υπαλληλ, ξηροτυρ, καμμι, κρατικ, story, ελεγχ, κτηρι, θελ, επιτελ, επιλογ, μικρ"
ανεξαρτητοι ελληνες - πανος καμμενος,"δημοσι, ελληνικ, ακινητ, ελλην, 2013, μεταλλει, 2012, μεταλλευτικ, μνημονι, cds, ελλαδ, λα, ανεξαρτητ, ρυθμις, οικονομικ, προυπολογισμ, πολιτ, κοινωνικ, μελετ, στοχ"
ανεξαρτητοι ελληνες εθνικη πατριωτικη δημοκρατικη συμμαχια,"ευρωπαικ, επιχειρης, εθνικ, ανθρωπ, οδηγι, ελλην, δικαι, ιθαγενει, κοινωνικ, αλλοδαπ, κρατ, προσανατολισμ, αποχετευς, δημοκρατι, γαμ, υδρευς, ελληνικ, συμφων, πραγματικ, ενως"
βουλη,"2018, εξωτερικ, νικολα, δημοκρατι, πρεβεζ, αμυν, υγει, πειραιως, αλβανι, ενως, 1617, 1592, 1618, 1588, καναλακι, 1616, κκυρι, θρησκευματ, ριζοσπαστικ, ανακοινωσω"
δημοκρατικη ανανεωση,"πυρκαι, δας, αναδασως, συχνοτητ, φυλακι, ασυρματ, αεροπλαν, πολεμ, κοιν, κατατριβομεθ, θεματ, υποδειξ, βοηθηθ, αναγκ, ναρκωτικ, δασικ, ιδιοκτησι, βιλ, κατασβες, σπευδ"
δημοκρατικη αριστερα,"αγροτικ, δημοσι, δεδ, πληροφορι, ανοικτοτητ, ανοικτ, αγροτ, παραγωγ, κομμα, τομ, λι, υποπτ, λιμενικ, διοικης, σχετικ, αναπτυξ, δημοκρατικ, διαθες, διαφανει, αριστερ"
δημοκρατικη συμπαραταξη (πανελληνιο σοσιαλιστικο κινημα - δημοκρατικη αριστερα),"ελληνικ, θεματ, δε, δημοσι, κυκλ, 2018, συνταξ, πολιτ, εθνικ, νε, σκελ, ελλαδ, απαντης, 2017, συμπαραταξ, ανθρωπ, οικονομικ, 10, καταθες, διαδικασι"
δημοκρατικο κοινωνικο κινημα,"ολυμπιακ, ειρηνοδικ, παιδι, εθνικ, οικονομικ, ρυθμις, δημοκρατι, αγων, κτελ, τελικ, τροπ, θελ, λα, δημοσι, ελληνικ, φορολογικ, διεξαγωγ, εφετ, ανδρ, χωρι"
ελληνικη λυση - κυριακος βελοπουλος,"ελλαδ, τιμουμ, τουρκι, επετει, ρωσι, δημοκρατι, ελλην, ευημερ, αγων, μαρκελλ, εθνικ, αγωνιστηκ, ακουστ, πακισταν, πρεσπ, ελεγ, συριζα, εμπαργκο, μαυρ, ελληνικ"
ενωση κεντρωων,"διαπιστευς, εθνικ, εργασι, δε, κεντρω, κωλυματ, λογω, φορτ, εποπτικ, μετρολογι, συζητειτα, νε, 2018, κλαδ, σελιδ, υγει, ελληνικ, αρχ, καναλι, ενως"
εξωκοινοβουλευτικός,"εργ, συνταξ, διαδικασι, ελληνικ, αποφας, δημοσι, επ, σωστ, υπηρεσι, σημαντικ, περιπτως, στοχ, πραγματι, πολιτιστικ, ρυθμις, πολιτ, προστασι, θεματ, τροπ, προβλημ"
κινημα αλλαγης,"εκλογικ, ελλην, αρχ, εκλογ, εξωτερικ, συγγραμματ, ασκης, ασυλι, εκπαιδευτικ, συνταγματικ, επιστολικ, αναθεωρης, περιορισμ, αλλαγ, λογω, ελλαδ, περιφερει, δημαρχ, εκπαιδευς, ποινικ"
κομμουνιστικο κομμα ελλαδας,"εργαζ, λα, ευρωπαικ, ενως, λαικ, κεφαλαι, δημοκρατι, δημοσι, κερδ, μετρ, ελληνικ, νε, κοινωνικ, πιο, αναγκ, γενικ, ζητημ, ελλαδ, συστημ, δικαιωματ"
λαικος ορθοδοξος συναγερμος,"ελληνικ, ελλαδ, δημοκρατι, ανθρωπ, πασοκ, δικαστ, ευρωπαικ, κοσμ, εθνικ, νε, εκαν, προβλημ, σχετικ, πολυτεκν, αρχ, αλβανι, στοιχει, ελλην, κοινωνικ, βλαχ"
λαικος συνδεσμος - χρυση αυγη,"ελληνικ, αυγ, χρυς, ελλην, ελλαδ, λα, πολιτ, δημοσι, φυσικ, κρατ, δημοκρατι, εθνικ, πατριδ, λαικ, αριστερ, οικογενει, εις, μεταναστ, σχετικ, θελ"
μετωπο ευρωπαικης ρεαλιστικης ανυπακοης (μερα25),"κορωνοι, παρελας, εισοδημ, covid, μικρ, αστυνομικ, αγροτικ, συνταξιουχ, αποκομιζ, παραβιαζουμ, κληρ, βαρουφακ, διαδος, ασφαλιστικ, σοσιαλισμ, περιεχ, εισφορ, πληρως, περιορισμ, κιλ"
νεα δημοκρατια,"δημοσι, ελληνικ, εργ, οικονομικ, νε, δημοκρατι, αποφας, εθνικ, κοινωνικ, ελλαδ, αρχ, θες, τροπ, περιοχ, περιπτως, διαδικασι, προτας, ευρωπαικ, ειδικ, σχετικ"
πανελληνιο σοσιαλιστικο κινημα,"δημοσι, ελληνικ, νε, δημοκρατι, εργ, οικονομικ, ελλαδ, υγει, κοινωνικ, εθνικ, αποφας, υπηρεσι, περιπτως, προυπολογισμ, ευρωπαικ, θες, προβληματ, τροπ, απαντης, πολιτ"
πολιτικη ανοιξη,"συνταξ, αγροτικ, οικονομικ, επιχειρης, οικονομι, μικρομεσαι, δημοκρατι, τοπ, διδαγμ, ερευνητικ, εκσυγχρονισμ, αναδιαρθρως, 10000, χορηγι, ζω, 70000, 23000, 13000, προυπολογισμ, ελληνικ"
συνασπισμος ριζοσπαστικης αριστερας,"δημοσι, ελληνικ, δημοκρατι, κοινωνικ, νε, διαδικασι, ανθρωπ, υγει, ελλαδ, κρατ, πολιτ, εργαζ, λειτουργι, αποφας, εργασι, σχες, ευρωπαικ, αρχ, νοσοκομει, πραγματικ"
συνασπισμος της αριστερας των κινηματων και της οικολογιας,"93, κατεθες, απαντης, δημοσι, δοθηκ, περιπτως, εγγραφ, εκατ, υπ, ακολουθ, προβλημ, θεματ, ελληνικ, ειδικ, 22393, γενικ, σχετικ, κοινωνικ, θες, προβληματ"
το ποταμι,"δημοσι, 2016, συστημ, θετικ, μνημονι, βι, θεματ, συμβας, κρατ, ενδοοικογενειακ, ηλεκτρονικ, νε, ελλαδ, ρυθμις, καζιν, συριζα, υγει, αποφας, οδηγι, θυματ"
