political_party,top_keywords
ανεξαρτητοι (εκτος κομματος),"ολυμπιακ, ελληνικ, ιδι, χωρ, πολιτικ, ναυτιλι, ναυτικ, φορολογικ, μεγαλ, κοινωνικ, παραοικονομι, νε, δημοσι, δημοκρατι, ελλαδ, ευρωπαικ, συστημ, δικαιοσυν, καμ, εθνικ"
ανεξαρτητοι δημοκρατικοι βουλευτες,"δικηγορικ, επιλογ, συλλογ, φραγ, πολιτικ, παρελθον, ευρωπαικ, ατζεντ, προβλημ, ξενοφοβι, μελλον, ακριτομυθι, πορτογαλ, κοινοβουλι, λεν, διαπραγματευς, χωρ, διν, προσοντ, αντιρατσιστικ"
ανεξαρτητοι ελληνες - πανος καμμενος,"λιγνιτ, ελληνικ, χωρ, δε, οικονομικ, πολιτικ, ελλην, ιδι, γενοκτονι, ενεργει, mw, οργανισμ, μεγαλ, ομμ, δημοσι, τον, αρμενι, αυθαιρετ, αξι, ελλαδ"
ανεξαρτητοι ελληνες εθνικη πατριωτικη δημοκρατικη συμμαχια,"τζιβ, σχολικ, μοναδ, θες, νομισμ, δημοκρατι, ιδι, συγκεκρι, τε, ελλαδ, εκπαιδευτηρι, μοριοδοτης, λειτουργι, νε, εκπαιδευτικ, προτας, δημοσι, χριστοφοριδ, ανθρωπ, πλημμελει"
βουλη,"2018, κρατειτα, υγει, ριζοσπαστικ, δημοκρατι, νε, 30, συνασπισμ, κατσωτ, συμβεβλ, επιστολ, κομμουνιστικ, δημητρι, αριστερ, σχετικ, λασιθι, χρηστ, κυκλ, ελλαδ, δωδεκανης"
δημοκρατικη αριστερα,"πορνογραφι, πορνογραφικ, σεξουαλικ, αστυνομι, ρυθμις, δημοσι, μεγαλ, πολιτ, παιδικ, ερωτικ, λειτουργ, ιδι, κρατ, εθνικ, υλικ, υγει, θεματ, αναπαραστας, συμβουλι, πολλ"
δημοκρατικη συμπαραταξη (πανελληνιο σοσιαλιστικο κινημα - δημοκρατικη αριστερα),"χωρ, ελληνικ, πρωτ, πολιτικ, τσιπρ, εκπαιδευς, συγκεκρι, διαδικασι, ος, ιδι, πολιτ, εθνικ, 2016, ευρωπαικ, προτας, δε, δημοσι, τροπ, μεγαλ, νε"
δημοκρατικο κοινωνικο κινημα,"πολιτικ, φαρμακ, ιδι, λα, μεγαλ, αγροτ, ος, χωρ, αμστερνταμ, αγροτικ, πραγματι, υπηρεσι, δημοσι, ελληνικ, πραγματικ, ευρωπ, κεραι, τελευται, ανθρωπ, πολιτ"
ελληνικη λυση - κυριακος βελοπουλος,"νιαρχ, συμβας, ιδρυμ, νοσοκομει, κομοτην, ελληνικ, ραδιοφαρμακ, δημοσι, εργ, κοστ, γενικ, ix, ελλαδ, καταθεσουμ, εαβ, περιβαλλοντικ, συμβουλι, σταυρ, αναρωτιομαστ, μεθ"
ενωση κεντρωων,"κεντρω, τσιπρ, ενως, δημοκρατι, λα, χωρ, ανθρωπ, νε, εννοουσατ, μητσοτακ, ος, πλευρ, βαρ, πολιτικ, πρεσπ, μανιφεστ, πολιτ, θετικ, υπολοιπ, εκλογ"
εξωκοινοβουλευτικός,"δημοσι, χωρ, ος, πρωτ, μεγαλ, ελεγχ, περιβαλλοντικ, εργ, φορολογικ, πολιτικ, ελληνικ, διαδικασι, τελ, περιπτως, πολλ, ιδι, ειδικ, φοροδιαφυγ, οικονομικ, θεματ"
κινημα αλλαγης,"αεροδιακομιδ, πολιτικ, ακαταδιωκτ, αποφευγουμ, αεροσκαφ, υγει, χωρ, αρριαν, περιπτως, εκτακτ, συστημ, δημοκρατι, ανωριμ, δωρ, κινητικοτητ, εθνικ, πρωτ, μπορους, συνταγματ, πολλ"
κομμουνιστικο κομμα ελλαδας,"πολιτικ, ευρωπαικ, λα, χωρ, εργαζ, ενως, ιδι, λαικ, μεγαλ, δημοσι, κεφαλαι, αντιλαικ, υγει, συγκεκρι, δημοκρατι, ος, μετρ, κοινωνικ, αναγκ, νε"
λαικη ενοτητα,"αναφορ, νικολοπουλ, επιστολ, νικολα, ας, αχαι, πολυτεκν, παρακαλεισθ, προωθης, αιτημ, παρακαλουμ, ανασυγκροτης, ηλει, κατεθες, εθελοντ, gennet, ελο, θρησκευματ, οικογεν, περιβαλλοντ"
λαικος ορθοδοξος συναγερμος,"χωρ, ελλαδ, ελληνικ, μεγαλ, δημοκρατι, πρωτ, επενδυς, πασοκ, συγκεκρι, αρα, πολιτ, συναγερμ, ανθρωπ, ιδι, ευρωπαικ, λα, ορθοδοξ, αναπτυξ, λαικ, κρατ"
λαικος συνδεσμος - χρυση αυγη,"ελληνικ, αυγ, χρυς, χωρ, συγκεκρι, ελλαδ, λα, εσπα, μπομπολ, πολλ, ος, πατριδ, ελλην, μακεδονι, πολιτικ, ανθρωπ, δημοκρατι, λαθρομεταναστ, ιδι, οικονομικ"
μετωπο ευρωπαικης ρεαλιστικης ανυπακοης (μερα25),"fraport, 2020, μέρα25, δημοσι, παπανατσι, ιδι, αυτονοητ, εταιρει, πανδημι, αεροδρομι, ακομη, διοικητικ, ευρωπαικ, χωρ, απαραιτητ, αναγκαι, καταστας, περιπτως, μελ, εντελως"
νεα δημοκρατια,"χωρ, πολιτικ, ιδι, δημοσι, ελληνικ, μεγαλ, πρωτ, εργ, ος, εθνικ, κατεθες, συγκεκρι, οικονομικ, αποφας, πολλ, νε, θες, ελλαδ, κοινωνικ, αναπτυξ"
οικολογοι εναλλακτικοι (ομοσπονδια οικολογικων εναλλακτικων οργανωσεων),"οικολογ, εναλλακτικ, αλλοτριων, βολαν, λοταρι, λοττ, τζογαδορ, φειγ, συνειδης, αδηφαγ, αξιοπεριεργ, ευρεσιτεχνι, εφευρ, νεοπλουτισμ, ζηταμ, παντως, επιστησω, θεαματ, λαχει, σκεφθηκατ"
πανελληνιο σοσιαλιστικο κινημα,"χωρ, πολιτικ, μεγαλ, ιδι, δημοσι, ελληνικ, πρωτ, εργ, δημοκρατι, νε, ος, εθνικ, αρχ, πολλ, συγκεκρι, κοινωνικ, οικονομικ, πολιτ, περιοχ, αναπτυξ"
πολιτικη ανοιξη,"πολιτικ, προτας, θρακ, επιχειρης, εκατ, περιοχ, τζογ, αναπτυξ, τρυπ, ιδι, παραλογ, ρυθμις, καπιταλισμ, δημοκρατι, κινδυν, ανηθικ, γυναικ, μαυρ, στοχευ, δραχμ"
συνασπισμος ριζοσπαστικης αριστερας,"χωρ, δημοσι, πολιτικ, μεγαλ, ελληνικ, ος, ιδι, δημοκρατι, υγει, κοινωνικ, νε, πρωτ, πολλ, λα, διαδικασι, εργαζ, αρχ, συγκεκρι, τροπ, ελλαδ"
συνασπισμος της αριστερας των κινηματων και της οικολογιας,"93, πολιτικ, χωρ, ιδι, μεγαλ, κατεθες, προβλημ, τροπ, δημοσι, θεματ, προβληματ, απαντης, εγγραφ, ελεγχ, συγκεκρι, γενικ, περιπτως, δοθηκ, προτας, ος"
το ποταμι,"χωρ, ιδι, βοσκοτοπ, πολιτικ, εθνικ, κτηνοτροφ, αδικι, βοσκης, σουδ, τροπ, λυς, βοσκησιμ, γαι, ος, διαχειρις, 2018, διαδικασι, προσληψ, εκτος, οικονομικ"
